{"v":"atlas.chunk/1","c":[-8,-9],"seed":20261101,"frame":{"t":"Sea chunk -8_-9","d":"217 cells: 77 water, 140 floor."},"cells":[[-16,-9,1,"floor"],[-16,-8,0,"water"],[-16,-7,0,"water"],[-16,-6,3,"floor"],[-16,-5,0,"water"],[-16,-4,0,"water"],[-16,-3,1,"floor"],[-16,-2,0,"water"],[-16,-1,3,"floor"],[-15,-10,0,"water"],[-15,-9,0,"water"],[-15,-8,1,"floor"],[-15,-7,1,"floor"],[-15,-6,3,"floor"],[-15,-5,3,"floor"],[-15,-4,1,"floor"],[-15,-3,1,"floor"],[-15,-2,0,"water"],[-15,-1,2,"floor"],[-14,-11,1,"floor"],[-14,-10,2,"floor"],[-14,-9,3,"floor"],[-14,-8,0,"water"],[-14,-7,2,"floor"],[-14,-6,1,"floor"],[-14,-5,0,"water"],[-14,-4,0,"water"],[-14,-3,1,"floor"],[-14,-2,3,"floor"],[-14,-1,0,"water"],[-13,-12,0,"water"],[-13,-11,2,"floor"],[-13,-10,1,"floor"],[-13,-9,1,"floor"],[-13,-8,3,"floor"],[-13,-7,2,"floor"],[-13,-6,3,"floor"],[-13,-5,2,"floor"],[-13,-4,3,"floor"],[-13,-3,2,"floor"],[-13,-2,3,"floor"],[-13,-1,0,"water"],[-12,-13,0,"water"],[-12,-12,1,"floor"],[-12,-11,0,"water"],[-12,-10,3,"floor"],[-12,-9,0,"water"],[-12,-8,2,"floor"],[-12,-7,1,"floor"],[-12,-6,1,"floor"],[-12,-5,0,"water"],[-12,-4,2,"floor"],[-12,-3,3,"floor"],[-12,-2,0,"water"],[-12,-1,3,"floor"],[-11,-14,0,"water"],[-11,-13,1,"floor"],[-11,-12,2,"floor"],[-11,-11,1,"floor"],[-11,-10,2,"floor"],[-11,-9,3,"floor"],[-11,-8,2,"floor"],[-11,-7,0,"water"],[-11,-6,2,"floor"],[-11,-5,0,"water"],[-11,-4,0,"water"],[-11,-3,1,"floor"],[-11,-2,3,"floor"],[-11,-1,0,"water"],[-10,-15,1,"floor"],[-10,-14,3,"floor"],[-10,-13,3,"floor"],[-10,-12,0,"water"],[-10,-11,3,"floor"],[-10,-10,2,"floor"],[-10,-9,1,"floor"],[-10,-8,0,"water"],[-10,-7,0,"water"],[-10,-6,3,"floor"],[-10,-5,0,"water"],[-10,-4,0,"water"],[-10,-3,2,"floor"],[-10,-2,0,"water"],[-10,-1,3,"floor"],[-9,-16,0,"water"],[-9,-15,0,"water"],[-9,-14,0,"water"],[-9,-13,2,"floor"],[-9,-12,2,"floor"],[-9,-11,2,"floor"],[-9,-10,0,"water"],[-9,-9,0,"water"],[-9,-8,3,"floor"],[-9,-7,3,"floor"],[-9,-6,3,"floor"],[-9,-5,0,"water"],[-9,-4,0,"water"],[-9,-3,1,"floor"],[-9,-2,0,"water"],[-9,-1,0,"water"],[-8,-17,0,"water"],[-8,-16,1,"floor"],[-8,-15,2,"floor"],[-8,-14,0,"water"],[-8,-13,3,"floor"],[-8,-12,0,"water"],[-8,-11,3,"floor"],[-8,-10,2,"floor"],[-8,-9,2,"floor"],[-8,-8,3,"floor"],[-8,-7,0,"water"],[-8,-6,0,"water"],[-8,-5,2,"floor"],[-8,-4,0,"water"],[-8,-3,3,"floor"],[-8,-2,1,"floor"],[-8,-1,2,"floor"],[-7,-17,0,"water"],[-7,-16,0,"water"],[-7,-15,0,"water"],[-7,-14,1,"floor"],[-7,-13,3,"floor"],[-7,-12,1,"floor"],[-7,-11,0,"water"],[-7,-10,0,"water"],[-7,-9,3,"floor"],[-7,-8,0,"water"],[-7,-7,2,"floor"],[-7,-6,0,"water"],[-7,-5,1,"floor"],[-7,-4,2,"floor"],[-7,-3,0,"water"],[-7,-2,3,"floor"],[-6,-17,2,"floor"],[-6,-16,0,"water"],[-6,-15,2,"floor"],[-6,-14,0,"water"],[-6,-13,3,"floor"],[-6,-12,2,"floor"],[-6,-11,3,"floor"],[-6,-10,2,"floor"],[-6,-9,0,"water"],[-6,-8,1,"floor"],[-6,-7,3,"floor"],[-6,-6,0,"water"],[-6,-5,1,"floor"],[-6,-4,2,"floor"],[-6,-3,3,"floor"],[-5,-17,0,"water"],[-5,-16,3,"floor"],[-5,-15,2,"floor"],[-5,-14,3,"floor"],[-5,-13,0,"water"],[-5,-12,2,"floor"],[-5,-11,0,"water"],[-5,-10,1,"floor"],[-5,-9,0,"water"],[-5,-8,1,"floor"],[-5,-7,2,"floor"],[-5,-6,1,"floor"],[-5,-5,3,"floor"],[-5,-4,2,"floor"],[-4,-17,0,"water"],[-4,-16,1,"floor"],[-4,-15,3,"floor"],[-4,-14,1,"floor"],[-4,-13,0,"water"],[-4,-12,1,"floor"],[-4,-11,2,"floor"],[-4,-10,3,"floor"],[-4,-9,0,"water"],[-4,-8,1,"floor"],[-4,-7,1,"floor"],[-4,-6,3,"floor"],[-4,-5,3,"floor"],[-3,-17,0,"water"],[-3,-16,3,"floor"],[-3,-15,0,"water"],[-3,-14,0,"water"],[-3,-13,1,"floor"],[-3,-12,0,"water"],[-3,-11,0,"water"],[-3,-10,2,"floor"],[-3,-9,1,"floor"],[-3,-8,3,"floor"],[-3,-7,3,"floor"],[-3,-6,1,"floor"],[-2,-17,0,"water"],[-2,-16,1,"floor"],[-2,-15,0,"water"],[-2,-14,1,"floor"],[-2,-13,1,"floor"],[-2,-12,0,"water"],[-2,-11,3,"floor"],[-2,-10,3,"floor"],[-2,-9,3,"floor"],[-2,-8,2,"floor"],[-2,-7,2,"floor"],[-1,-17,1,"floor"],[-1,-16,2,"floor"],[-1,-15,3,"floor"],[-1,-14,0,"water"],[-1,-13,0,"water"],[-1,-12,1,"floor"],[-1,-11,2,"floor"],[-1,-10,3,"floor"],[-1,-9,0,"water"],[-1,-8,1,"floor"],[0,-17,3,"floor"],[0,-16,3,"floor"],[0,-15,3,"floor"],[0,-14,0,"water"],[0,-13,1,"floor"],[0,-12,1,"floor"],[0,-11,2,"floor"],[0,-10,1,"floor"],[0,-9,0,"water"]],"assets":["sea-palette"]}
