{"v":"atlas.chunk/1","c":[-18,34],"seed":20261101,"frame":{"t":"Sea chunk -18_34","d":"217 cells: 91 water, 126 floor."},"cells":[[-26,34,3,"floor"],[-26,35,0,"water"],[-26,36,1,"floor"],[-26,37,0,"water"],[-26,38,2,"floor"],[-26,39,0,"water"],[-26,40,1,"floor"],[-26,41,0,"water"],[-26,42,2,"floor"],[-25,33,0,"water"],[-25,34,1,"floor"],[-25,35,0,"water"],[-25,36,2,"floor"],[-25,37,3,"floor"],[-25,38,0,"water"],[-25,39,0,"water"],[-25,40,1,"floor"],[-25,41,3,"floor"],[-25,42,1,"floor"],[-24,32,3,"floor"],[-24,33,2,"floor"],[-24,34,1,"floor"],[-24,35,0,"water"],[-24,36,0,"water"],[-24,37,3,"floor"],[-24,38,0,"water"],[-24,39,1,"floor"],[-24,40,2,"floor"],[-24,41,1,"floor"],[-24,42,0,"water"],[-23,31,1,"floor"],[-23,32,2,"floor"],[-23,33,1,"floor"],[-23,34,3,"floor"],[-23,35,0,"water"],[-23,36,1,"floor"],[-23,37,3,"floor"],[-23,38,0,"water"],[-23,39,0,"water"],[-23,40,0,"water"],[-23,41,1,"floor"],[-23,42,3,"floor"],[-22,30,0,"water"],[-22,31,0,"water"],[-22,32,3,"floor"],[-22,33,0,"water"],[-22,34,0,"water"],[-22,35,3,"floor"],[-22,36,3,"floor"],[-22,37,2,"floor"],[-22,38,2,"floor"],[-22,39,3,"floor"],[-22,40,3,"floor"],[-22,41,1,"floor"],[-22,42,2,"floor"],[-21,29,0,"water"],[-21,30,2,"floor"],[-21,31,2,"floor"],[-21,32,3,"floor"],[-21,33,3,"floor"],[-21,34,0,"water"],[-21,35,3,"floor"],[-21,36,0,"water"],[-21,37,3,"floor"],[-21,38,0,"water"],[-21,39,0,"water"],[-21,40,0,"water"],[-21,41,1,"floor"],[-21,42,3,"floor"],[-20,28,1,"floor"],[-20,29,0,"water"],[-20,30,2,"floor"],[-20,31,0,"water"],[-20,32,2,"floor"],[-20,33,3,"floor"],[-20,34,0,"water"],[-20,35,1,"floor"],[-20,36,3,"floor"],[-20,37,3,"floor"],[-20,38,2,"floor"],[-20,39,3,"floor"],[-20,40,0,"water"],[-20,41,2,"floor"],[-20,42,2,"floor"],[-19,27,0,"water"],[-19,28,3,"floor"],[-19,29,3,"floor"],[-19,30,0,"water"],[-19,31,1,"floor"],[-19,32,0,"water"],[-19,33,0,"water"],[-19,34,3,"floor"],[-19,35,1,"floor"],[-19,36,3,"floor"],[-19,37,2,"floor"],[-19,38,0,"water"],[-19,39,1,"floor"],[-19,40,1,"floor"],[-19,41,0,"water"],[-19,42,1,"floor"],[-18,26,1,"floor"],[-18,27,2,"floor"],[-18,28,0,"water"],[-18,29,1,"floor"],[-18,30,0,"water"],[-18,31,3,"floor"],[-18,32,2,"floor"],[-18,33,2,"floor"],[-18,34,3,"floor"],[-18,35,0,"water"],[-18,36,1,"floor"],[-18,37,3,"floor"],[-18,38,1,"floor"],[-18,39,1,"floor"],[-18,40,0,"water"],[-18,41,0,"water"],[-18,42,0,"water"],[-17,26,2,"floor"],[-17,27,0,"water"],[-17,28,2,"floor"],[-17,29,0,"water"],[-17,30,0,"water"],[-17,31,3,"floor"],[-17,32,0,"water"],[-17,33,3,"floor"],[-17,34,3,"floor"],[-17,35,1,"floor"],[-17,36,2,"floor"],[-17,37,0,"water"],[-17,38,0,"water"],[-17,39,2,"floor"],[-17,40,2,"floor"],[-17,41,2,"floor"],[-16,26,1,"floor"],[-16,27,0,"water"],[-16,28,0,"water"],[-16,29,2,"floor"],[-16,30,0,"water"],[-16,31,0,"water"],[-16,32,0,"water"],[-16,33,0,"water"],[-16,34,0,"water"],[-16,35,0,"water"],[-16,36,3,"floor"],[-16,37,0,"water"],[-16,38,3,"floor"],[-16,39,2,"floor"],[-16,40,0,"water"],[-15,26,2,"floor"],[-15,27,2,"floor"],[-15,28,0,"water"],[-15,29,3,"floor"],[-15,30,2,"floor"],[-15,31,2,"floor"],[-15,32,0,"water"],[-15,33,3,"floor"],[-15,34,0,"water"],[-15,35,0,"water"],[-15,36,3,"floor"],[-15,37,2,"floor"],[-15,38,2,"floor"],[-15,39,0,"water"],[-14,26,0,"water"],[-14,27,1,"floor"],[-14,28,0,"water"],[-14,29,3,"floor"],[-14,30,2,"floor"],[-14,31,0,"water"],[-14,32,2,"floor"],[-14,33,1,"floor"],[-14,34,0,"water"],[-14,35,0,"water"],[-14,36,0,"water"],[-14,37,1,"floor"],[-14,38,0,"water"],[-13,26,2,"floor"],[-13,27,1,"floor"],[-13,28,0,"water"],[-13,29,0,"water"],[-13,30,0,"water"],[-13,31,3,"floor"],[-13,32,0,"water"],[-13,33,2,"floor"],[-13,34,0,"water"],[-13,35,0,"water"],[-13,36,2,"floor"],[-13,37,0,"water"],[-12,26,0,"water"],[-12,27,0,"water"],[-12,28,0,"water"],[-12,29,0,"water"],[-12,30,0,"water"],[-12,31,1,"floor"],[-12,32,3,"floor"],[-12,33,2,"floor"],[-12,34,1,"floor"],[-12,35,0,"water"],[-12,36,1,"floor"],[-11,26,1,"floor"],[-11,27,1,"floor"],[-11,28,2,"floor"],[-11,29,0,"water"],[-11,30,3,"floor"],[-11,31,0,"water"],[-11,32,3,"floor"],[-11,33,0,"water"],[-11,34,3,"floor"],[-11,35,1,"floor"],[-10,26,0,"water"],[-10,27,2,"floor"],[-10,28,1,"floor"],[-10,29,0,"water"],[-10,30,3,"floor"],[-10,31,0,"water"],[-10,32,0,"water"],[-10,33,0,"water"],[-10,34,3,"floor"]],"assets":["sea-palette"]}
